{
  "version": "0.1.0",
  "layoutTreeSha256": "f908d0b9a42104b6a9f990072fb4c6468a4e43b43fb73d7faa0f5239afb7bfc7",
  "registrySha256": "028aa6a9f330e3199fef0fa331111229648ca8299f78d376df70e93a5b0ec369",
  "items": [
    {
      "sourceId": "header-title",
      "intent": "static",
      "preferredId": null,
      "variant": null,
      "confidence": "high",
      "rationale": "Explicit frozen prototype and admitted source state; no implicit resource substitution.",
      "evidence": [
        "e1"
      ]
    },
    {
      "sourceId": "field-name",
      "intent": "text",
      "preferredId": "form.input.default.medium",
      "variant": "default",
      "confidence": "high",
      "rationale": "Explicit frozen prototype and admitted source state; no implicit resource substitution.",
      "evidence": [
        "e3"
      ]
    },
    {
      "sourceId": "field-status",
      "intent": "choice",
      "preferredId": "form.select.default.medium",
      "variant": "default",
      "confidence": "high",
      "rationale": "Explicit frozen prototype and admitted source state; no implicit resource substitution.",
      "evidence": [
        "e4"
      ]
    },
    {
      "sourceId": "query-action",
      "intent": "action",
      "preferredId": "action.button.primary.medium",
      "variant": "default",
      "confidence": "high",
      "rationale": "Explicit frozen prototype and admitted source state; no implicit resource substitution.",
      "evidence": [
        "e6"
      ]
    },
    {
      "sourceId": "scope-content",
      "intent": "static",
      "preferredId": null,
      "variant": null,
      "confidence": "high",
      "rationale": "Explicit frozen prototype and admitted source state; no implicit resource substitution.",
      "evidence": [
        "e5"
      ]
    },
    {
      "sourceId": "user-table",
      "intent": "records",
      "preferredId": "data.table.default",
      "variant": "default",
      "confidence": "high",
      "rationale": "Explicit frozen prototype and admitted source state; no implicit resource substitution.",
      "evidence": [
        "e10",
        "e11"
      ]
    },
    {
      "sourceId": "list-title",
      "intent": "static",
      "preferredId": null,
      "variant": null,
      "confidence": "high",
      "rationale": "Explicit frozen prototype and admitted source state; no implicit resource substitution.",
      "evidence": [
        "e8"
      ]
    },
    {
      "sourceId": "export-action",
      "intent": "static",
      "preferredId": null,
      "variant": null,
      "confidence": "high",
      "rationale": "Explicit frozen prototype and admitted source state; no implicit resource substitution.",
      "evidence": [
        "e9"
      ]
    },
    {
      "sourceId": "list-summary",
      "intent": "static",
      "preferredId": null,
      "variant": null,
      "confidence": "high",
      "rationale": "Explicit frozen prototype and admitted source state; no implicit resource substitution.",
      "evidence": [
        "e12"
      ]
    }
  ]
}
